{
  "entity_id": "ent_5f5564d303c49c2bbfb12e63",
  "contract_version": "1.0.0",
  "company_id": "company-demo",
  "entity_type": "supplier",
  "canonical_label": "ACME Industrial",
  "identifiers": [
    {
      "scheme": "abn",
      "value": "12345678901",
      "normalized_value": "12345678901",
      "strength": "strong",
      "source_id": "procurement-provider"
    },
    {
      "scheme": "supplier_id",
      "value": "vendor-448",
      "normalized_value": "vendor-448",
      "strength": "medium",
      "source_id": "procurement-provider"
    }
  ],
  "aliases": [
    {
      "alias": "Acme Industrial Pty Limited",
      "normalized_alias": "acme industrial pty limited",
      "source_id": "procurement-provider"
    },
    {
      "alias": "ACME Industrial",
      "normalized_alias": "acme industrial",
      "source_id": "procurement-provider"
    }
  ],
  "attributes": {
    "address": {
      "raw": "10 Example Road, Melbourne",
      "normalized": "10 example road melbourne"
    }
  },
  "source_records": [
    {
      "source_kind": "provider",
      "source_id": "procurement-provider",
      "record_id": "vendor-448",
      "observed_at": "2026-09-03T00:05:00Z",
      "evidence_ids": [],
      "locator": null
    }
  ],
  "resolution": {
    "state": "provisional",
    "confidence": 0.7,
    "method": "created",
    "match_evidence": [],
    "conflicts": []
  },
  "lineage": {
    "merged_from": [],
    "split_from": [],
    "supersedes": []
  },
  "created_at": "2026-09-02T15:38:30.884032Z",
  "updated_at": "2026-09-02T15:38:30.884032Z",
  "extension_data": {}
}
